https://www.vote.org/state/maryland	मेरील्याण्ड	आफै गएरः निर्वाचनको मितिको २१ दिन अघि । तपाईंले प्रारम्भिक मतदानको समयमा वा निर्वाचनको मितिमा ठेगानाको प्रमाण सहित दर्ता गर्न सक्नुहुन्छ। निर्वाचन दिन दर्ता प्रकृया हेर्नुहोस। मेल द्वारा: निर्वाचनको मितिको अघि 21 दिन पोस्टमार्क गरिएको। तपाईंले प्रारम्भिक मतदानको समयमा वा निर्वाचनको मितिकोमा ठेगानाको प्रमाण सहित दर्ता गर्न सक्नुहुन्छ।  निर्वाचन दिन दर्ता प्रकृया हेर्नुहोस। अनलाइन: निर्वाचनको मितिको अघि २१ दिन। तपाईंले प्रारम्भिक मतदानको समयमा वा निर्वाचनको मितिकोमा ठेगानाको प्रमाण सहित दर्ता गर्न सक्नुहुन्छ।  निर्वाचन दिन दर्ता प्रकृया हेर्नुहोस।	तपाईंले प्रारम्भिक मतदानको समयमा र निर्वाचनको मितिकोमा व्यक्तिगत रूपमा मतदान गर्न दर्ता गर्न सक्नुहुन्छ। तपाईंले हालको र वैध फोटो आईडी कार्ड (जस्तै, मेरील्याण्ड ड्राइभर लाइसेन्स, MVA- जारी गरिएको आईडी कार्ड, विद्यार्थी, कर्मचारी, वा सैन्य आईडी कार्ड, अमेरिकी राहदानी, वा कुनै अन्य राज्य वा संघीय सरकारले जारी गरेको आईडी कार्ड) ल्याउन आवश्यक छ; वा युटिलिटी बिलको प्रतिलिपि, बैंक स्टेटमेन्ट, सरकारी चेक, पेचेक वा अन्य सरकारी कागजात जसले तपाईंको नाम र ठेगाना देखाउँदछ र जुन निर्वाचनको 3 महिना भित्रमा मिति हुन्छ।
https://www.vote.org/state/massachusetts	म्यासाचुसेट्स	आफै गएरः निर्वाचनको मितिको 10 दिन अघि। मेल द्वारा: निर्वाचनको मितिको 10 दिन अघि पोस्टमार्क। अनलाइन: निर्वाचनको मितिको 10 दिन अघि।	यो सुविधा उपलब्ध छैन
https://www.vote.org/state/michigan	मिशिगन	आफै गएरः कुनै पनि समय तपाईंको शहर वा टाउनशिप क्लर्कको कार्यालयमा निर्वाचनको मितिमा साँझ 8 बजे सम्म। मेल द्वारा: निर्वाचनको मितिको 15 दिन अघि पोस्टमार्क। अनलाइन: निर्वाचनको मितिको 15 दिन अघि।	तपाईंले आफ्नो सहर वा टाउनशिप क्लर्कको कार्यालयमा निर्वाचनको मितिकोमा एकै समयमा मतदान गर्न र मतदान गर्न दर्ता गर्न सक्नुहुन्छ। तपाईंले बसोबासको प्रमाण पेश गर्न आवश्यक छ, जस्तै ड्राइभर इजाजतपत्र वा राज्य व्यक्तिगत पहिचान कार्ड। यदि तपाईंसँग यी कागजातहरू छैनन् भने, तपाईंले यसको सट्टा सरकारी वा शैक्षिक संस्थाद्वारा जारी गरिएको हालको फोटो आईडी र हालको उपयोगिता बिल, बैंक स्टेटमेन्ट, पेचेक, सरकारी चेक, वा तपाईंको नाम र हालको निवास ठेगाना समावेश भएको अन्य सरकारी कागजातहरू प्रदान गर्न सक्नुहुन्छ।
https://www.vote.org/state/minnesota	मिनेसोटा	आफै गएरः निर्वाचनको मिति सम्म। मेल द्वारा: निर्वाचनको मितिको 21 दिन अघि साँझ 5 बजे । अनलाइन: निर्वाचनको दिन २१ दिन अघि राति ११:५९ बजे सम्म्।	यदि तपाईंले मतदाता दर्ताको अन्तिम मिति गुमाउनुभएको छ भने, तपाईं अझै पनि मतदान गर्न दर्ता गर्न सक्नुहुन्छ र व्यक्तिगत अनुपस्थित मतदान अवधि (प्रारम्भिक मतदान) वा निर्वाचनको मितिकोमा एकै समयमा मतदान गर्न सक्नुहुन्छ। दर्ता गर्न र भोट गर्नको लागि केवल तपाईको नियमित व्यक्तिगत अनुपस्थित मतदान साइटमा -- वा तपाईको नियमित मतदान स्थलमा जानुहोस्। तपाईंले मान्य र हालको मिनेसोटा ड्राइभर इजाजतपत्र, सिक्ने अनुमति पत्र, परिचयपत्र (वा यी मध्ये कुनै एकको लागि रसिद), वा आदिवासी आईडी ल्याउनु पर्छ। यदि ID ले तपाइँको हालको नाम र ठेगाना सूचीबद्ध गर्दैन भने, तपाइँको हालको नाम र ठेगाना सहितको कागजातको अतिरिक्त यसलाई वा फरक फोटो आईडी ल्याउनुहोस्। कागजात एक उपयोगिता बिल, क्रेडिट कार्ड वा बैंकिङ स्टेटमेन्ट, वा धितो वा लीज स्टेटमेन्ट हुन सक्छ वा निर्वाचनको 30 दिन भित्र मिति हुन सक्छ; हालको पट्टा; वा विद्यार्थी शुल्क विवरण। यो तपाईंको इलेक्ट्रोनिक उपकरणमा देखाउन सकिन्छ। यदि तपाइँसँग कुनै प्रश्न छ भने तपाइँको स्थानीय निर्वाचन कार्यालयलाई सम्पर्क गर्नुहोस्।
https://www.vote.org/state/mississippi	मिसिसिपी	आफै गएरः निर्वाचनको मितिको 30 दिन अघि । यदि 30 औं दिन आइतवार वा बिदामा पर्छ भने, त्यसपछिको  कार्यालय खुलेको पहिलो दिन। मेल द्वारा: निर्वाचनको मितिको 30 दिन अघि पोस्टमार्क। यदि 30 औं दिन आइतवार वा कानुनी बिदामा पर्छ भने, पोस्टमार्क म्याद त्यसपछिको  कार्यालय खुलेको पहिलो दिन। अनलाइन: यो सुविधा उपलब्ध छैन।	यो सुविधा उपलब्ध छैन
https://www.vote.org/state/missouri	मिजोरी	आफै गएरः  निर्वाचनको मितिको अघिको चौथो बुधबार सम्म । मेल द्वारा: निर्वाचनको मिति अघिको चौथो बुधबार सम्म पोस्टमार्क गरिएको। अनलाइन: निर्वाचनको मितिको अघिको चौथो बुधबार ।	यो सुविधा उपलब्ध छैन
https://www.vote.org/state/montana	मोन्टाना	आफै गएरः निर्वाचनको मितिको अघिल्लो दिन मध्यान्न सम्म। मेल द्वारा: निर्वाचनको मितिको 30 दिन अघि पोस्टमार्क गरिएको र निर्वाचनको मितिको 27 दिन अघि प्राप्त हुनुपर्ने। अनलाइन: यो सुविधा उपलब्ध छैन	तपाईंले ढिलो दर्ता विकल्प मार्फत दर्ता गर्न र निर्वाचनको दिन मतदान गर्न सक्नुहुन्छ।
https://www.vote.org/state/nebraska	नेब्रास्का	आफै गएरः निर्वाचनको मितिको 11 दिन अघि  मेल द्वारा: निर्वाचनको मिति भन्दा 18 दिन अघि पोस्टमार्क गरिएको। अनलाइन: निर्वाचनको मितिको 18 दिन अघि ।	यो सुविधा उपलब्ध छैन
https://www.vote.org/state/nevada	नेभाडा	आफै गएरः निर्वाचनको दिनभन्दा २८ दिन अघि (वा प्रारम्भिक मतदानको समयमा वा निर्वाचनको मितिमा उही दिन दर्ता)। मेल द्वारा: निर्वाचनको मितिको 28 दिन अघि पोस्टमार्क गरिएको। यदि तपाईंले यो म्याद छुटाउनुभयो भने, तपाईं प्रारम्भिक मतदानको समयमा वा निर्वाचनको मितिमा दर्ता गर्न सक्नुहुन्छ। अनलाइन: निर्वाचनको दिनभन्दा ५ दिन अगाडि। यदि तपाईंले यो म्याद छुटाउनुभयो भने, तपाईं प्रारम्भिक मतदानको समयमा वा निर्वाचनको मितिमा दर्ता गर्न सक्नुहुन्छ।	तपाईंले प्रारम्भिक मतदानको समयमा वा निर्वाचनको मितिकोमा मतदान स्थलमा व्यक्तिगत रूपमा मतदान गर्न दर्ता गर्न सक्नुहुन्छ। मतदानमा मतदान गर्न तपाईंले वैध नेभाडा ड्राइभर इजाजतपत्र वा पहिचान कार्ड देखाउनुपर्छ। यदि पहिचानमा तपाईंको हालको ठेगाना छैन भने, तपाईंले निवासको प्रमाण पनि देखाउनुपर्छ।
https://www.vote.org/state/new-hampshire	न्यू ह्याम्पशायर	आफै गएरः निर्वाचनको मितिमा। निर्वाचनको दिन को ६ देखि १३ दिन अघि पर्यवेक्षकहरूको अन्तिम बैठक बस्दछ, मतदाता दर्ता त्यस अघि नै गरिसक्नु पर्छ। यस्तो बैठक कहिले बस्छ भन्ने जानकारीको लागि सम्बन्धित नगरपालिका कार्यालमा बुझ्नु पर्दछ।  निर्वाचनको मितिको अघि 6-13 दिन। आफ्नो सहर/शहरको वेबसाइट जाँच गर्नुहोस्, वा पर्यवेक्षकको बैठकको मिति, समय र स्थानको लागि आफ्नो क्लर्कको कार्यालयमा कल गर्नुहोस्। मेल मार्फत: तपाइँ कुन शहरमा बस्नुहुन्छ भन्ने आधारमा, निर्वाचनको मितिको भन्दा 6 र 13 दिनको बीचमा । अनलाइन: यो सुविधा उपलब्ध छैन	यदि तपाईंले मतदाता दर्ताको अन्तिम मिति छुटाउनुभएको छ भने, तपाईं अझै पनि मतदान गर्न दर्ता गर्न सक्नुहुन्छ र निर्वाचनको दिनमा एकै समयमा मतदान गर्न सक्नुहुन्छ। दर्ता गर्न र भोट गर्नको लागि केवल आफ्नो नियमित मतदान स्थल वा प्रारम्भिक मतदान स्थलमा जानुहोस्। मतदाताले मत दिनको लागि मान्य फोटो परिचयपत्र ल्याउनु पर्नेछ। वैध फोटो आईडी नल्याउने मतदाताहरूले चुनौतीपूर्ण मतदाता शपथपत्र फारम कार्यान्वयन गर्छन् र पछि उनीहरूले मतदान गरेको पुष्टि गर्न अनुरोध गर्ने पत्र प्राप्त गर्नेछन्। प्रक्रिया वा पहिचान आवश्यकताहरू बारे प्रश्नहरूको लागि आफ्नो स्थानीय निर्वाचन कार्यालयलाई सम्पर्क गर्नुहोस्।
https://www.vote.org/state/new-jersey	न्यु जर्सी	आफै गएरः निर्वाचनको मितिको २१ अघि दिन। मेल द्वारा: निर्वाचनको मितिको 21 दिन अघि पोस्टमार्क गरिएको। अनलाइन: निर्वाचनको मितिको २१ दिन अघि ।	यो सुविधा उपलब्ध छैन
https://www.vote.org/state/new-mexico	न्यू मेक्सिको	आफै गएरः काउन्टी क्लर्कको कार्यालयमा (वा काउन्टी क्लर्कले अधिकार दिएको अन्य स्थान) मा निर्वाचन दिन अघिल्लो शनिबार सम्म। अन्यथा निर्वाचनको दिनभन्दा २८ दिन अगाडि। मेल द्वारा: निर्वाचनको मितिको 28 दिन अघि पोस्टमार्क गरिएको। यदि अन्तिम मिति भन्दा पहिले आवेदन पोस्टमार्क गरिएको छ भने अन्तिम मिति पछिको शुक्रवार सम्म आवेदन स्वीकार गर्न सकिन्छ। अनलाइन: निर्वाचनको दिन 28 दिन अघि।	न्यू मेक्सिकोमा कुनै पनि योग्य मतदाताले मतदान गर्न वा आफ्नो मतदाता दर्ता अद्यावधिक गर्न दर्ता गर्न सक्छन् र त्यसपछि उही दिन आफ्नो काउन्टी क्लर्कको कार्यालयमा वा निर्वाचनको मितिकोमा उनीहरूको काउन्टीको कुनै पनि मतदान स्थानमा र प्रारम्भिक मतदान स्थानहरूमा भाग लिन मतदान गर्न सक्छन्। मतदान गर्नु अघि दर्ता गर्न, तपाईंले निम्न मध्ये एक ल्याउन आवश्यक छ:  (1) कर र राजस्व विभागको मोटर वाहन डिभिजन मार्फत जारी गरिएको न्यू मेक्सिको ड्राइभर इजाजतपत्र वा न्यू मेक्सिको पहिचान कार्ड; (२) कुनै पनि कागजात जसमा काउन्टीको ठेगाना सहितको फोटो परिचय पत्र; वा (३) न्यू मेक्सिकोको पोस्ट-सेकेन्डरी शैक्षिक संस्थाबाट हालको मान्य विद्यार्थी फोटो पहिचान कार्डको साथमा काउन्टीमा विद्यार्थीको ठेगाना समावेश गरिएको हालको विद्यार्थी शुल्क विवरण।
https://www.vote.org/state/new-york	न्यू योर्क	आफै गएरः निर्वाचनको मितिको 10 दिन अघि। मेल द्वारा: निर्वाचनको मितिको 15 दिन अघि पोस्टमार्क भै निर्वाचनको मितिको भन्दा १० दिन अघि प्राप्त हुनु पर्ने। अनलाइन: निर्वाचनको मितिको 10 दिन अघि।	यो सुविधा उपलब्ध छैन
https://www.vote.org/state/north-carolina	नर्थ क्यारोलिना	व्यक्तिगत रूपमा: निर्वाचनको मितिको अघिल्लो शनिबार व्यक्तिगत रूपमा भोटिङ छ भने। (अन्यथा निर्वाचनको दिनभन्दा २५ दिन अगाडि।) मेल द्वारा: निर्वाचनको मितिको 25 दिन अघि पोस्टमार्क। यदि पोस्टमार्क छैन वा अस्पष्ट छ भने, निर्वाचनको मितिको भन्दा 20 दिन अगाडी सम्म प्राप्त आवेदन स्विकार गरिन्छ। अनलाइन: निर्वाचनको मितिको अघि 25 दिन।	उही दिन दर्ता सामान्यतया प्रारम्भिक मतदान अवधिमा मात्र उपलब्ध हुन्छ, तर निर्वाचनको मितिकोमा होइन। निम्न कागजातहरू मध्ये एउटा आवश्यक छ: उत्तरी क्यारोलिना ड्राइभर इजाजतपत्र, सरकारी एजेन्सीले जारी गरेको अन्य फोटो पहिचान, हालको उपयोगिता बिलको प्रतिलिपि, बैंक स्टेटमेन्ट, सरकारी चेक, पेचेक, वा मतदाताको नाम र ठेगाना देखाउने अन्य सरकारी कागजात, हालको कलेज/विश्वविद्यालयको फोटो परिचय पत्र क्याम्पस बसोबासको प्रमाण वा मतदान प्रयोजनका लागि स्वीकृत गरिएको अन्य फोटो परिचय पत्रसँग जोडिएको छ।  दर्ताको अन्तिम मिति (निर्वाचनको मितिको अघि 25 औं दिन) र निर्वाचनको मितिको बीचमा मतदान गर्न योग्य भएका निश्चित व्यक्तिहरूले निर्वाचनको दिनमा दर्ता गर्न आवेदन दिन सक्छन्: काउन्टी बोर्ड अफ इलेक्शनको सदस्य, काउन्टी डाइरेक्टर, निर्वाचन। वा मुख्य न्यायाधीश वा क्षेत्रको न्यायाधीश जसमा व्यक्ति मतदान गर्न योग्य छ। यदि आवेदन स्वीकृत भएमा, व्यक्तिले सोही दिन मतदान गर्न सक्छ। यो ती व्यक्तिहरूमा लागू हुन्छ जो भर्खरै संयुक्त राज्य अमेरिकाको अंगीकृत नागरिक बनेका छन् वा जो अपराधको सजाय पछि नागरिकतामा पुनर्स्थापित भएका छन्, तर यो 17 वर्ष पुरानो र दर्ताको म्याद पछि 18 पुगेका व्यक्तिहरूमा लागू हुँदैन।
https://www.vote.org/state/north-dakota	नर्थ डकोटा	आफै गएरः नर्थ डकोटामा मतदाता दर्ता आवश्यक पर्दैन। तसर्थ, मतदाताले स्वीकार्य परिचय पत्र देखाएमा योग्य मतदाताले निर्वाचनमा मतदान गर्न सक्छ। मेल द्वारा: नर्थ डकोटालाई मतदाता दर्ता आवश्यक पर्दैन। तसर्थ, मतदाताले स्वीकार्य पहिचान प्रदान गरेमा योग्य मतदाताले निर्वाचनमा मतदान गर्न सक्छ। अनलाइन: यो सुविधा उपलब्ध छैन	नर्थ डकोटालाई मतदाता दर्ताको आवश्यकता पर्दैन। तसर्थ, मतदाताले स्वीकार्य पहिचान प्रदान गरेमा एक योग्य मतदाताले निर्वाचनमा मतदान गर्न सक्छ।
